{"binding_reference":{"content_hash":"sha256:b7a19f4b0b87adc12fedc17346b2af99a50219ba320e191431f50a7a43b11d64","implementation_id":"schuss-implementation-000041","revision":1},"canonical_profile":"schuss-canonical-json-v1","conformance_probe_evidence_id":"schuss-conformance-probe-evidence-000005","content_hash":"sha256:de76089e2031fe8b26f8b0ddc8f96da5fbbb8e6cfd1fa4fea7807b84c57f93e0","evidence_level":5,"limitations":["No connected-device, real-time, or audible procedure ran.","The probe grants no production selection authority by itself."],"outcome":"passed","probe_result_reference":{"conformance_probe_result_id":"schuss-conformance-probe-result-000005","content_hash":"sha256:c6631bcecb53a7c18ec21c6e1d99a49481cf94c944a4f11b437d768c69a37e07","revision":1},"procedure_reference":{"content_hash":"sha256:86954dd767c3d49e396f25313f467d843b4d168d24e317e435fd61737c111985","procedure_id":"schuss-procedure-000002","revision":1},"revision":1,"schema_version":"conformance-probe-evidence-v0"}
