{"binding_reference":{"content_hash":"sha256:e72dd177c4984b525782b0395c96cdc816907b1bf0731902acc729c1c49062bd","implementation_id":"schuss-implementation-000004","revision":1},"canonical_profile":"schuss-canonical-json-v1","conformance_probe_evidence_id":"schuss-conformance-probe-evidence-000008","content_hash":"sha256:6abcebd3b40c9b89d97bd80161792d11d5f4f3eaa36ec03f666d0a02ee3659ab","evidence_level":5,"limitations":["No connected-device, real-time, or audible procedure ran.","The probe grants no production selection authority by itself."],"outcome":"passed","probe_result_reference":{"conformance_probe_result_id":"schuss-conformance-probe-result-000008","content_hash":"sha256:3199255a3fcb10030c05c85e883ec21b911d034b646ceac04082bc819e36b35e","revision":1},"procedure_reference":{"content_hash":"sha256:86954dd767c3d49e396f25313f467d843b4d168d24e317e435fd61737c111985","procedure_id":"schuss-procedure-000002","revision":1},"revision":1,"schema_version":"conformance-probe-evidence-v0"}
